"content","cmp_code","eu_code"
"Deutschland ist dabei nicht nur Vorreiter in der nationalen Umsetzung, sondern auch international treibende Kraft.","601",NA
"Schattenbanken kontrollieren",NA,NA
"Besondere Aufmerksamkeit werden wir dabei den sogenannten Schattenbanken widmen.","403",NA
"Wir wollen vermeiden, dass Zweckgesellschaften, Geldmarktfonds oder Hedgefonds klassische Bankgeschäfte außerhalb des regulierten Bankensektors abwickeln.","403",NA
"Sonst entstehen neue Risiken, die mit allen bisherigen und künftigen Regulierungsmaßnahmen gerade vermieden werden sollen.","403",NA
"Finanztransaktionssteuer weltweit einführen",NA,NA
"Wir haben zusammen mit zehn anderen EU-Ländern verabredet, möglichst schnell eine Finanztransaktionssteuer einzuführen.","403",NA
"Während andere nur reden, hat die unionsgeführte Bundesregierung gehandelt.","305",NA
"Bei der Umsetzung werden wir darauf achten, dass Wettbewerbsverzerrungen vermieden und die Interessen des Finanzplatzes Deutschlands gewahrt bleiben.","403",NA
"Nur als ein starker und wettbewerbsfähiger Finanzplatz kann Deutschland auch weiterhin aktiv die Regulierung der internationalen Finanzmärkte mitgestalten.","403",NA
"Unser Ziel bleibt es dabei, die Steuer nicht nur in Europa, sondern langfristig weltweit einzuführen.","107",NA
"Universalbankensystem erhalten – Mittelstandsfinanzierung sicherstellen",NA,NA
"Unsere Bankenstruktur mit Genossenschaftsbanken, Privatbanken und Sparkassen hat sich insbesondere in der Finanzmarktkrise als stabil erwiesen.","601",NA
"Wir wollen diese Struktur erhalten und stärken.","601",NA
"Denn sie sichert nicht nur die Finanzierung des Mittelstands, sondern stellt den Menschen auch vielfältige Bankangebote für ihren Alltag vor Ort zur Verfügung.","403",NA
"Gleichzeitig wollen wir vermeiden, dass Risiken aus Eigenhandelsgeschäften der Banken Sparguthaben und Kreditgeschäfte der Anleger gefährden.","403",NA
"Deshalb haben wir dafür gesorgt, dass bestimmte hochspekulative Geschäfte vom Einlagen-und Kreditgeschäft abgetrennt werden.","403",NA
"2.7  Nachhaltiges Wachstum schafft Lebensqualität",NA,NA
"Wachstum hat das Leben vieler Menschen in unserem Land, aber auch weltweit, in beispielloser Weise verbessert und Wohlstand ermöglicht.","410",NA
"Dabei ist Wachstum in der Sozialen Marktwirtschaft kein Selbstzweck.","416",NA
"Marktwirtschaft und Wachstum müssen dem Menschen dienen.","416",NA
"In diesem Sinne muss die Soziale Marktwirtschaft immer auch fortentwickelt werden.","403",NA
"Dazu gehört, die gesellschaftlichen und wirtschaftlichen Entwicklungsmöglichkeiten nachkommender Generationen stärker als bisher zu sichern.","416",NA
"Deshalb wollen wir ein Wachstum, das Ökonomie, Ökologie und Soziales miteinander verbindet.","416",NA
"Dies gilt gerade angesichts der vor uns liegenden Herausforderungen wie dem globalen Klimawandel, der Versorgung einer immer größer werdenden Weltbevölkerung und der Wirtschafts-und Finanzkrise.","416",NA
"Nachhaltiges Wachstum bedeutet nicht einfach „mehr“, sondern vor allem „Besseres“ zu schaffen.","416",NA
"Wir wollen eine Wirtschaft, die Vorreiter bei nachhaltigen Produkten, intelligenten Lösungen und Strategien zur Verbesserung der Vereinbarkeit von Umwelt und Wirtschaft ist.","416",NA
"Nachhaltigkeit in allen Lebensbereichen und weltweit erreichen",NA,NA
"Unser Verständnis von Wachstum und Wohlstand weist über den Tag hinaus und muss drei Aspekte von Nachhaltigkeit erfüllen:","416",NA
"1.       Nachhaltigkeit muss in einer vernetzten und globalisierten Welt, auch international verankert werden.","107",NA
"Eine internationale Ordnungspolitik der Nachhaltigkeit muss darauf hinwirken, lokal und global, in entwickelten Industrieländern sowie in Entwicklungs-und Schwellenländern den Übergang in das Zeitalter energieeffizienter, umweltfreundlicher Produktion, stabiler Finanz-und hoher sozialer Standards anzustoßen und partnerschaftlich zu begleiten.",NA,NA
"2.       Ökonomisch und finanziell nachhaltiges Wachstum erfordert vor allem, die Verschuldungspolitik zu beenden.","414",NA
"In Folge der internationalen Finanzkrise besteht jetzt die historische Chance, eine nachhaltige Finanzpolitik in Deutschland, Europa und der Welt durchzusetzen.","414",NA
"3.       Der Mensch ist Teil der Schöpfung.",NA,NA
"Sie zu schützen ist unser Auftrag.","501",NA
"Das Prinzip der Nachhaltigkeit ist fester Bestandteil unserer Politik.","501",NA
"Wir wollen unseren Nachkommen eine Welt bewahren und hinterlassen, die auch morgen noch lebenswert ist.","501",NA
"Ganz entscheidend für ökologische Nachhaltigkeit ist, dass bereits eine deutliche Entkopplung von Wirtschaftswachstum und Ressourcenverbrauch gelungen ist.","416",NA
"Diesen Weg gilt es fortzusetzen.","416",NA
"Menschen zur Teilhabe zu befähigen und dadurch den gesellschaftlichen Zusammenhalt zu stärken – das ist soziale Nachhaltigkeit.","501",NA
"Jeder Mensch soll sich gemäß seinen Fähigkeiten beteiligen, einbringen und einen Beitrag zum Wohle aller leisten können.","503",NA
"Das heißt insbesondere, Bildung weiter in allen Lebensphasen zu fördern,","506",NA
"es heißt, noch mehr Arbeitsuchende in Arbeit zu bringen","701",NA
"und es heißt, die Bereitschaft der Menschen für ehrenamtliches Engagement noch mehr als bisher zu heben.","606",NA
"Neue Maßstäbe für die Wohlstandmessung",NA,NA
"Dieses Verständnis von Wohlstand kann das Bruttoinlandsprodukt (BIP) allein nicht abbilden.","416",NA
"Es ist eine gute Kennzahl, um die Wirtschaftsleistung zu messen und dafür ist es auch weiter notwendig.","410",NA
"Mehr kann es aber nicht messen.","416",NA
"Deshalb sind wir der Auffassung, dass wir ein neues Instrument brauchen, das diesem umfassenden Verständnis von Wohlstand und Lebensqualität gerecht wird.","416",NA
"Vor diesem Hintergrund begrüßen wir die Vorschläge der Enquete-Kommission „Wachstum, Wohlstand, Lebensqualität“ des Deutschen Bundestages.","416",NA
"So sollen neben dem Bruttoinlandsprodukt unter anderem auch Schulden des Staates und der Privathaushalte, Beschäftigungsquote, Bildungsabschlüsse sowie Fort-und Weiterbildungsquote, Gesundheit, demokratische Mitsprache sowie Luftverschmutzung und Artenvielfalt in nationaler und internationaler Perspektive ermittelt werden.","416",NA
"Damit würde eine umfassende Abbildung des Wohlstandes möglich.","416",NA
"Als Schritt in diese Richtung wollen wir bei staatlichen Maßnahmen künftig verstärkt den Nutzen im Hinblick auf eine nachhaltige Entwicklung darstellen.","416",NA
"Damit schaffen wir die Voraussetzung für eine über reine Kostenberechnungen hinausgehende Betrachtung.","416",NA
"3. Deutschlands Chancen nutzen",NA,NA
"3.1. Bildungsrepublik Deutschland",NA,NA
"Bildung fängt zu Hause an, bei den Kleinsten: Mutter und Vater beginnen, was Kita, Schule, Betrieb und Hochschule fortsetzen.","506",NA
"Doch damit ist noch lange nicht Schluss: Lebenslanges Lernen wird für unser Land und seine Menschen immer wichtiger.","506",NA
"Deswegen haben wir die Bildungsrepublik Deutschland auf den Weg gebracht und wollen deren Ausbau in den kommenden Jahren fortsetzen.","506",NA
"Jedes Kind verdient beste Startchancen, um seine Fähigkeiten bestmöglich entwickeln zu können.","506",NA
"Wir wollen Schule und Ausbildung mit digitalem Lernen verbinden,","506",NA
"für erstklassige Schul-und Studienbedingungen sorgen","506",NA
"und eine „Nationale Initiative Weiterbildung“ anstoßen.","411",NA
"Bildung steht deshalb weiter im Mittelpunkt unseres Handelns.","506",NA
"Seit 2005 haben wir die Ausgaben für Bildung Jahr für Jahr erhöht.","506",NA
"Allein die Hilfen des Bundes für die Hochschulen haben sich in den vergangenen acht Jahren verdoppelt.","506",NA
"Wir wollen die öffentlichen und privaten Bildungsausgaben weiter steigern.","506",NA
"Gleiche Bildungschancen von Anfang an",NA,NA
"Kinder sind geborene Entdecker und Forscher.","506",NA
"Von Kindesbeinen an wollen sie herausfinden, wie die Welt um sie herum funktioniert.","506",NA
"Mit einer guten frühkindlichen Bildung und Erziehung unterstützen wir sie dabei.","506",NA
"Leider gibt es eine wachsende Zahl von Kindern, die zu Hause von ihren Eltern nur unzureichend die deutsche Sprache lernen.","506",NA
"Daher setzen wir uns für Sprachtests für alle Kinder ab drei Jahren ein.","506",NA
"Wo sich herausstellt, dass die Sprachkenntnisse nicht ausreichen, soll eine verpflichtende Sprachförderung in der Kita und in der Schule erfolgen.","506",NA
"Die bestmögliche Schule für unsere Kinder",NA,NA
"Wir bekennen wir uns zu einem vielfältigen und durchlässigen Bildungsangebot.","506",NA
"Das Konzept der rot-grünen Einheitsschule ist ein Irrweg.","506",NA
"Es verkennt, dass jedes Kind einzigartig ist und geht damit an den Bedürfnissen und Interessen unserer Kinder vorbei.","201",NA
"Bei uns steht das einzelne Kind im Mittelpunkt.","201",NA
"Wir wollen jedes Kind entsprechend seiner Möglichkeiten fördern und fordern.","506",NA
"Dazu setzen wir auf eine gute und vertrauensvolle Zusammenarbeit mit den Eltern.","603",NA
"CDU und CSU stehen zur Zukunft des Gymnasiums,","506",NA
"leistungsstarken Schulen zur Vorbereitung vor allem einer Berufsausbildung","506",NA
"und der Gleichwertigkeit von allgemeiner und beruflicher Bildung.","503",NA
"Statt Einheitsbrei wollen wir für unsere Kinder eine Vielfalt der Bildungswege, die ihnen vielfältige Berufs-und Lebenswege eröffnen.","506",NA
"Für uns gilt das Ziel: Kein Abschluss ohne Anschluss.","506",NA
"Pakt für eine gute Bildung",NA,NA
"Tag für Tag gehen unsere Kinder morgens in die Schule – von der Grund-bis zur Berufsschule.","506",NA
"Sie ist der wichtigste Ort des Lernens.","506",NA
"Wir wollen die Chancen auf eine erfolgreiche Schulzeit verbessern.","506",NA
"Mit einem Bildungspakt zwischen Bund, Ländern und Kommunen wollen wir dafür die Voraussetzungen schaffen.","506",NA
"Dazu gehören:",NA,NA
"Ausbau der Ganztagsbetreuung",NA,NA
"Hochwertige Ganztagsschulen unterstützen dieses Ziel.","506",NA
"Daher wollen wir eine bedarfsgerechte Ganztagsbetreuung auch unter Einbeziehung von außerschulischen Kräften wie beispielsweise Vereinen oder ehrenamtlichen Strukturen in ganz Deutschland sicherstellen.","506",NA
"Gleichzeitig leisten wir so auch einen entscheidenden Beitrag für die bessere Vereinbarkeit von Familie und Beruf.","603",NA
"Schule 2.0",NA,NA
"Die rasante Entwicklung der Informationstechnologien bietet neue Chancen in der Bildung.","506",NA
"Die Nutzung digitaler Medien an unseren Schulen muss mit der digitalen Entwicklung besser Schritt halten.","506",NA
"Wir wollen, dass unsere Kinder mit Blick auf die großen Chancen der Digitalisierung für das spätere Arbeitsleben bereits in der Schule einen verantwortlichen und sinnvollen Umgang mit den neuen technischen Möglichkeiten erlernen und ihnen zugleich neue, interessante Wege der Wissensvermittlung eröffnet werden.","506",NA
"Wir wollen dafür sorgen, dass unsere Schulen auf der Höhe der Zeit ausgestattet sind.","506",NA
"Dazu gehören zum Beispiel moderne Computertechnik, digitale Lernangebote und eine bessere Vernetzung der Schulen.","506",NA
"Wenn das Klassenzimmer den Weg in die digitale Welt findet, erschließt sich eine neue Bildungswelt, in der Kinder ganz selbstverständlich die neuen technischen Möglichkeiten kennenlernen.","506",NA
"Digitale Bildung muss deutlich mehr als bisher Bestandteil der Aus-und Fortbildung von Lehrern werden.","506",NA
"Gute Lehrerinnen und Lehrer",NA,NA
"Gute Schule ist guter Unterricht und Grundlage für guten Unterricht sind hervorragend ausgebildete und hoch motivierte Lehrkräfte.","506",NA
"Wir wollen, dass aus Lehramtsstudierenden Lehrer werden, die diesen Beruf aus Überzeugung ergreifen und mit Herzblut ausfüllen.","506",NA
"Um ihnen eine hervorragende Ausbildung mit auf den Weg zu geben, werden wir eine halbe Milliarde Euro für eine „Qualitätsoffensive Lehrerbildung“ bereitstellen, mit der gute Ausbildungskonzepte an den Hochschulen für einen modernen Unterricht auf der Höhe der Zeit unterstützt werden.","506",NA
"Der Dienst an den Kindern zählt zu den wichtigsten Aufgaben für eine gute Zukunft unseres Landes.","506",NA
"Deshalb wollen wir, dass die Arbeit der Lehrerinnen und Lehrer gesellschaftlich besser anerkannt wird.","704",NA
"Medien-und Informationskompetenz stärken",NA,NA
"Die Menschen sollen die Chancen und Risiken der Digitalisierung selbst einschätzen und sich sicher im digitalen Zeitalter bewegen können.","506",NA
"Deshalb wollen wir die Medien-und Informationskompetenz verbessern.","506",NA
"Wir wollen Menschen jeden Alters mit dem nötigen Wissen ausstatten, das die Grundlage für eigenverantwortliches Handeln online wie offline bildet.","506",NA
"Schulen in freier und privater Trägerschaft garantieren Vielfalt",NA,NA
"Neben den öffentlichen Schulen bereichern Schulen in freier und privater Trägerschaft unsere Bildungslandschaft und fördern den Wettbewerb zwischen den Schulen.","507",NA
"Sie sind Ausdruck eines großen bürgerschaftlichen und kirchlichen Engagements.","507",NA
"Wir stehen verlässlich zu unserer Unterstützung dieser Schulen.","507",NA
"Religionsunterricht gehört in den Fächerkanon",NA,NA
"Religionsunterricht muss als eigenständiges Fach an unseren Schulen verankert sein.","603",NA
"Wer wie die Grünen die Abschaffung des konfessionsgebundenen Religionsunterrichts fordert, ebnet den Weg zu einer Aushöhlung der für unsere Gesellschaft prägenden christlichen Werte.","603",NA
"Dem stellen wir uns entschieden entgegen.","603",NA
"Andere Unterrichtsinhalte wie Philosophie oder Ethik sind kein Ersatz für den Religionsunterricht und erfüllen schwerlich den Auftrag unseres Grundgesetzes.","603",NA
"Auf der Grundlage der Verfassung treten wir auch für islamischen Religionsunterricht an den Schulen ein.","603",NA
"Mehr Zusammenarbeit zwischen Bund und Ländern",NA,NA
"CDU und CSU stehen für eine zielorientierte Zusammenarbeit in der Bildungspolitik und für klare Zuständigkeiten zwischen Bund und Ländern.","303",NA
"Die Menschen sollen wissen, wer die Entscheidungen verantwortet.","303",NA
"Die Länder tragen die zentrale Verantwortung für Bildung.","301",NA
"Allerdings brauchen wir eine bessere Vergleichbarkeit der Abschlüsse zwischen den Ländern.","302",NA
"Gerade mit Blick auf die vielen Familien und deren Kinder, die jedes Jahr aus beruflichen Gründen zwischen den Ländern ihren Wohnort wechseln, brauchen wir gemeinsame Prüfungsstandards, die die Gleichrangigkeit der Abschlüsse sicherstellen.","302",NA
"Wir werden uns deshalb weiter für nationale Bildungsstandards einsetzen.","302",NA
"Gemeinsam mit den Ländern wollen wir nach Möglichkeiten für eine bessere Zusammenarbeit suchen und bestehende Hindernisse für eine bessere Zusammenarbeit einvernehmlich abbauen.","303",NA
"Berufliche Ausbildung stärken",NA,NA
"Wer eine abgeschlossene Berufsausbildung vorweisen kann, hat beste Chancen auf dem Arbeitsmarkt.","411",NA
"Unser Ziel ist es daher, dass auch künftig jeder ausbildungswillige und –fähige Jugendliche ein Ausbildungsangebot erhält, das zu einem anerkannten Abschluss führt.","411",NA
"Unsere duale Ausbildung in Betrieb und Berufsschule gilt dafür weltweit als Vorbild.","601",NA
"Sie ist ein wichtiger Grund dafür, dass wir die niedrigste Jugendarbeitslosigkeit in ganz Europa haben und es für junge ausgebildete Menschen nirgendwo einfacher ist einen Job zu finden als in Deutschland.","411",NA
"Wir wollen, dass noch mehr junge Menschen die Chancen der dualen Ausbildung nutzen können und wollen dafür zusammen mit der Wirtschaft die Voraussetzungen schaffen.","411",NA
"Das gilt ganz besonders für Menschen mit Zuwanderungsgeschichte, in Teilzeitausbildung oder mit einer Behinderung.","705",NA
"Wer sein Studium abbricht, soll gezielt für eine berufliche Ausbildung gewonnen werden und die an der Hochschule erfolgreich abgelegten Prüfungen besser anerkannt bekommen.","411",NA
"Übergang Schule – Beruf erleichtern",NA,NA
"Der Übergang von der Schule in die Ausbildung ist für nicht wenige junge Menschen schwierig.","706",NA
"Bei den einen ist die Schullaufbahn nicht so verlaufen wie gewünscht und es fehlen am Ende die Qualifikationen, um den Anforderungen an eine Lehrstelle gerecht zu werden.","506",NA
"Bei anderen Jugendlichen gibt es einen besonderen Förderbedarf.","705",NA
"Das kann bei jungen Menschen mit einer Behinderung der Fall sein.","705",NA
"In anderen Fällen sind es eine fehlende oder unzureichende Unterstützung aus dem Elternhaus oder eine Zuwanderungsgeschichte, die zu Schwierigkeiten führen.","705",NA
"Mit Blick auf die Chancen dieser Jugendlichen und den hohen Fachkräftebedarf unserer Wirtschaft wollen wir zusätzliche Anstrengungen unternehmen, um möglichst vielen dieser Menschen ohne Umwege und Warteschleifen den Weg in das Berufsleben zu ebnen.","305",NA
"Gerade Jugendlichen mit Behinderungen muss dabei unbürokratische Unterstützung zur Verfügung stehen.","305",NA
"Wir wollen dazu die praxisnahe Berufsorientierung in allen Schulformen weiter ausbauen","506",NA
"und mehr Angebote für praktisches Lernen schaffen, die betriebliche Arbeitserfahrung und Unterricht miteinander verbinden.","506",NA
"Auch längere berufsvorbereitende Praktika für schwächere Jugendliche können einen wichtigen Beitrag zum gelungenen Start ins Berufsleben leisten.","506",NA
"Wir wollen solche Maßnahmen verstärkt unterstützen.","506",NA
"Dazu wollen wir mit der „begleiteten Ausbildung“ vor allem für kleine und mittlere Betriebe im Bereich des Handwerks und Mittelstands eine Brücke zwischen Ausbildungsbetrieb und Auszubildenden schlagen.","411",NA
"Die zur Verfügung gestellten Unterstützungsangebote können für beide Seiten einen Beitrag zur erfolgreichen Ausbildung leisten.","411",NA
"Hochschulen zukunftsfest machen",NA,NA
"Ein breites und vielfältiges Angebot herausragender Hochschulen ist für unser Land unverzichtbar.","506",NA
"Zu Recht sind wir stolz auf unsere hervorragenden Hochschulen, die mit ihrer Leistung in Forschung und Lehre maßgeblich zu unserem Ansehen in der Welt beitragen.","601",NA
"Wissenschaftliche Erfolge, in Produkte übersetzt, schaffen Arbeitsplätze und sichern unseren Wohlstand.","411",NA
"Für uns ist entscheidend, dass sich unsere Hochschulen in jeder Hinsicht mit den Besten in der Welt messen können.","411",NA
"Dazu setzen wir auf eine vielfältige Hochschullandschaft, die unterschiedlichen Anforderungen und Interessen Rechnung trägt.","506",NA
"So ermöglichen duale Studiengänge und Fernstudienangebote Beruf und Studium gut miteinander zu verbinden.","701",NA
"Auch private Hochschulen bereichern diese Vielfalt.","507",NA
"Wir sind ihnen dabei ein verlässlicher Partner.","507",NA
"Studieren darf nicht vom Geldbeutel der Eltern abhängen – Studienfinanzierung verbessern",NA,NA
"Wir wollen, dass jeder seinen Begabungen nachgehen kann und unabhängig vom Geldbeutel der Eltern eine gute Ausbildung bekommt.","503",NA
"Deshalb werden wir die Studienfinanzierung weiter ausbauen und dazu das BAföG an die Lebenshaltungskosten sowie veränderte Bildungswege anpassen.","504",NA
"Auszubildende, die ihr Studium oder ihre schulische Ausbildung nur in Teilzeit absolvieren können, weil sie betreuungspflichtige Kinder haben, sollen bessere Förderbedingungen erhalten.","504",NA
"Das gilt auch für Studierende, die bereits eine abgeschlossene Berufsausbildung und Erfahrungen im Berufsleben haben und sich an der Hochschule weiterqualifizieren wollen.","504",NA
"Neben dem bewährten BAföG wollen wir auch Stipendien als eine gute Möglichkeit der Finanzierung und wichtigen Teil der Begabtenförderung weiter voranbringen.","504",NA
"Das neue Deutschlandstipendium ist gut angelaufen.","305",NA
"Dabei setzen wir für den weiteren Ausbau einer Stipendienkultur nicht nur auf den Staat.","505",NA
"Auch private Förderer aus der Wirtschaft sollen verstärkt einen Beitrag leisten.","505",NA
"Der Hochschulpakt ermöglicht gute Studienbedingungen",NA,NA
"Immer mehr junge Menschen studieren in Deutschland, die inhaltlichen Herausforderungen nehmen angesichts einer immer stärkeren Internationalisierung zu.","506",NA
"Unsere Hochschulen meistern diese neuen Aufgaben hervorragend und dennoch brauchen wir weitere Anstrengungen, um die Leistungsfähigkeit der Hochschulen zu steigern und sie auf weiter anwachsende Zahlen von Studienanfängern vorzubereiten.","506",NA
"Wir wollen diese Aufgabe gemeinsam mit den Hochschullehrern, der Studentenschaft, den akademischen und nicht wissenschaftlichen Mitarbeitern der Hochschulen anpacken.","506",NA
"Ein wichtiger Schritt ist die Fortsetzung des Hochschulpakts.","506",NA
"Einen besonderen Schwerpunkt soll die Verbesserung der Studienbedingungen bilden.","506",NA
"Der „Qualitätspakt Lehre“ und die „Qualitätsoffensive Lehrerbildung“ sind wichtige Schritte in diese Richtung.","506",NA
"Auch die Internationalisierung der Hochschulen wollen wir weiter voranbringen.","506",NA
"Ziel muss es sein, die besten Studenten und Forscher weltweit an unsere Hochschulen zu holen.","506",NA
"Dazu wollen wir englischsprachige Studienangebote sowie in internationaler Kooperation gemeinsam angebotene Studiengänge weiter ausbauen.","506",NA
"Studieren mit Kind muss leichter werden",NA,NA
"Studium und Elternschaft sollen sich nicht ausschließen.","603",NA
"Wir wollen, dass junge Menschen sich nicht zwischen Studium und Kind entscheiden müssen, sondern beides miteinander vereinbaren.","603",NA
"Dazu gehören bezahlbares Wohnen, eine flexible Gestaltung des Unialltags, wie beispielsweise kindgerechte Sprechzeiten, Kinderbetreuung in der Bibliothek oder Kinderessen in der Mensa.","504",NA
"In einem Wettbewerb wollen wir besonders familienfreundliche Hochschulen mit guten Ideen ermitteln und sie dafür auszeichnen.","504",NA
"Daneben müssen familienpolitische Elemente bei der Studienfinanzierung stärker berücksichtigt und im Wissenschaftszeitvertragsgesetz konsequent angewendet werden.","504",NA
"Top-Talente für die Wissenschaft",NA,NA
"Die Beschäftigungssituation von Nachwuchs-Wissenschaftlern hat sich positiv entwickelt.","701",NA
"Mit mehr als einer halben Millionen Mitarbeitern sind so viele Menschen wie noch nie an deutschen Hochschulen beschäftigt.","506",NA
"Das ist ein starkes Signal für die Zukunft.","506",NA
"Zugleich steigen damit die Erwartungen an eine bessere Planbarkeit von wissenschaftlichen Karrieren.","701",NA
"Hier wollen wir gemeinsam mit den Hochschulen gerade für den akademischen Mittelbau neue Akzente setzen, beispielsweise mit einem Förderprogramm für verlässliche Karrierewege an Hochschulen.","701",NA
"Befristungen im akademischen Mittelbau wollen wir abbauen.","701",NA
"Online-Hochschule: Das Internet revolutioniert das Lernen",NA,NA
"Das Internet führt zu ganz neuen Formen der Lehre an den Hochschulen.","411",NA
"In aller Welt werden neue Online-Studienmodelle entwickelt, die von fachspezifischen Kursen bis zu globalen Plattformen reichen.","411",NA
"Hier entsteht ein großer Zukunftsmarkt, der das Hochschulwesen nachhaltig verändern wird.","411",NA
"Wir müssen mit dabei sein, wenn die Internet-Hochschule der Zukunft entsteht.","411",NA
"Deshalb wollen wir die Hochschulen auf dem Weg zu attraktiven und wettbewerbsfähigen Angeboten zum digitalen Lernen unterstützen","506",NA
"und sie ermuntern Strategien für Qualitätssicherung, Finanzierung, Betreuung der Studierenden und Anrechnung der Studienleistungen zu entwickeln.","506",NA
"Zukunftschancen durch lebensbegleitendes Lernen sichern",NA,NA
"Das in der Welt verfügbare Wissen verdoppelt sich heute alle vier Jahre.","411",NA
"Angesichts dieser rasanten Entwicklung ist unser Land mehr denn je auf gut ausgebildete Fachkräfte angewiesen.","411",NA
"Dafür wollen wir gemeinsam mit Wirtschaft und Beschäftigten ein neues Bewusstsein für ein „Lebenslanges Lernen“ schaffen.","411",NA
"Mit attraktiven Bedingungen wollen wir die Arbeitnehmerinnen und Arbeitnehmer davon überzeugen, noch mehr Zeit und Kraft für ihre berufliche Weiterbildung aufzubringen.","411",NA
"Dazu wollen wir Lebenszeitkonten attraktiver gestalten, das Bildungssparen weiterentwickeln und so möglichst vielen Familien eröffnen sowie verbesserte Möglichkeiten zur Förderung von Weiterbildungsmaßnahmen einführen.","411",NA
"Im Rahmen einer „Nationalen Initiative Weiterbildung“ werden wir zusammen mit den Sozialpartnern, den staatlichen Akteuren, den Arbeitsagenturen, den Hochschulen und den privaten Anbietern gemeinsame Ziele verabreden und neue Ideen entwickeln, wie zum Beispiel betriebliche Weiterbildung regelmäßig im Arbeitsalltag stattfinden kann.","411",NA
"3.2 Bevölkerungswandel gestalten – Verantwortung für alle Generationen",NA,NA
"Noch nie waren die Aussichten auf ein langes, gesundes und erfülltes Leben in unserem Land so groß wie heute.","0",NA
"Die Lebenserwartung steigt stetig an.","0",NA
"Gleichzeitig aber werden weniger Kinder geboren und die Einwohnerzahl sinkt.","0",NA
"Die Folgen sind u. a.: Immer weniger Erwerbstätige müssen für immer mehr Menschen sorgen, die nicht im Erwerbsleben stehen.","701",NA
"Die Zahl der Schüler geht zurück, den Unternehmen droht ein Mangel an Fachkräften.","411",NA
"Für die Älteren – und die Menschen mit Behinderung – gibt es zu wenig barrierefreie Wohnungen und Häuser, während in manchen Orte Wohnraum leer steht.","705",NA
"Dies alles macht den Bevölkerungswandel zu einer der größten Herausforderungen unseres Landes.","601",NA
"Ihn zu bewältigen sehen wir als eine nationale Aufgabe, die alle gesellschaftlichen Gruppen betrifft.","601",NA
"Wir müssen gemeinsam Lösungen auf dringende Fragen finden:","606",NA
"Dazu zählen u.a. die Schul-und Arztversorgung auf dem Land,","504",NA
"die Zukunft der Rente,","504",NA
