"content","cmp_code","eu_code"
"Konkret wollen wir die degressive Abschreibung für den Mietwohnungsbau wieder einführen.","402",NA
"Stärkung des sozialen Wohnungsbaus",NA,NA
"Zur Unterstützung einkommensschwächerer Haushalte bei den Wohnkosten wollen wir den sozialen Wohnungsbau stärken.","504",NA
"Seit Jahren sinkt die Zahl der Wohnungen mit einer Mietpreis-und Belegungsbindung.","504",NA
"Wir wollen diesen Trend umkehren und die Länder bei der sozialen Wohnraumversorgung unterstützen.","504",NA
"Im Gegenzug wird von den Ländern die Zusage erwartet, dass sie diese Mittel zweckgebunden für den sozialen Wohnungsbau einsetzen.","504",NA
"Die Schaffung studentischen Wohnraums in unseren Hochschulstädten gehört ausdrücklich dazu.","504",NA
"Es geht dabei vor allem darum, ungenutzte Räumlichkeiten zu Studentenunterkünften umzuwandeln sowie den Bau von zusätzlichen Studentenwohnungen anzuregen.","504",NA
"Der Bund und mehrere Länder unterstützen diese Maßnahmen bereits im Rahmen der bestehenden KfW-Programme und der sozialen Wohnraumförderung.","504",NA
"Vor Ort besteht eine Fülle an Möglichkeiten, den Wohnungsbau zu unterstützen.","504",NA
"Hierzu gehören beispielsweise Bündnisse mit kommunalen Wohnungsunternehmen, die Entwicklung spezieller Fördermodelle, insbesondere für Familien und altersgerechtes Wohnen, sowie die verbilligte Abgabe kommunaler Grundstücke an Wohnungsbauinvestoren.","504",NA
"Wir wollen gemeinsam mit den Ländern und Kommunen dazu beitragen, dass solche Initiativen mit Leben gefüllt werden, beispielsweise indem ungenutzte Flächen im Eigentum der öffentlichen Hand oder nicht mehr benötigte Immobilien wie ehemalige Kasernen oder Verwaltungsgebäude zur Verfügung gestellt werden.","504",NA
"Wohnen muss bezahlbar sein",NA,NA
"Eines unserer zentralen Anliegen ist bezahlbarer Wohnraum für einkommensschwache Haushalte.","503",NA
"Der Bund und die öffentlichen Hände kommen hier ihrer sozialen Verantwortung in beträchtlichem Umfang nach.","504",NA
"Jahr für Jahr werden rund 17 Milliarden Euro für die Wohnkosten einkommensschwacher Haushalte aufgewendet.","504",NA
"Das Wohngeld und die Erstattung der Kosten der Unterkunft im Rahmen der Sozialen Grundsicherung sichern die Mietzahlungsfähigkeit von Haushalten mit geringem Einkommen.","504",NA
"Für diese Haushalte sollen verstärkt Belegungsrechte erworben werden.","503",NA
"Um Menschen mit geringem Einkommen direkt zu helfen und gutes Wohnen zu ermöglichen, wollen wir die Leistungen des Wohngeldes weiter verbessern.","504",NA
"Wir wollen die Leistungshöhe und die Miethöchstbeträge an die Entwicklung der Bestandsmieten anpassen und setzen uns für eine Regelung ein, die für die Zukunft eine Anpassung der Wohngeldleistung an die Entwicklung der Wohnkosten sicherstellt.","504",NA
"Auch die Haushalte, die kein Wohngeld erhalten, werden wir unterstützen.","504",NA
"Das soziale Mietrecht schützt vor unangemessenen Mietpreissteigerungen.","412",NA
"Um flexibel auf die Mietenentwicklung in Ballungsräumen reagieren zu können, haben wir den Ländern die Möglichkeit eingeräumt, in Gebieten mit knappem Wohnraumangebot, die Grenze für Mieterhöhungen innerhalb von drei Jahren von 20 auf 15 Prozent zu senken.","412",NA
"Damit Wohnraum in Städten mit angespannten Wohnungsmärkten bezahlbar bleibt, werden wir den Ländern zudem die Möglichkeit einräumen in Gebieten mit angespannten Wohnungsmärkten bei Wiedervermietung von Bestandswohnungen Mieterhöhungen auf zehn Prozent oberhalb der ortsüblichen Vergleichsmiete zu beschränken.","412",NA
"Diese Regel gilt nicht für Erstvermietungen in Neubauten.","401",NA
"Klare Regeln für Mieter und Vermieter",NA,NA
"Das Dienstleistungsangebot im Immobiliensektor ist gewachsen.","403",NA
"Damit verbunden sind oft neue Anforderungen an Haus-oder Wohnungseigentümer und Hausbauer.","403",NA
"Auch Mieter und Käufer nutzen immer stärker professionalisierte Dienstleistungsangebote.","403",NA
"Wir wollen daher den Verbraucherschutz bei Bau-und Dienstleistungen im Immobiliensektor ausbauen.","403",NA
"Das betrifft zum Beispiel das Bauvertragsrecht und die Wohnungsverwaltung.","403",NA
"Für Maklerleistungen wollen wir klare bundeseinheitliche Rahmenbedingungen schaffen, um mehr Rechtssicherheit zu erzielen.","403",NA
"Vermieter und Mieter sollen weiter als Auftraggeber auftreten können.","403",NA
"Eigener Wohnraum sichert die Altersvorsorge",NA,NA
"Wir unterstützen den Wunsch vieler Menschen nach einem Leben in den eigenen vier Wänden.","409",NA
"Insbesondere junge Paare mit Kindern gehen dafür in der Gründungsphase ihrer Familie oft an die Grenzen der finanziellen Möglichkeiten, damit sie die oft größte Anschaffung ihres Lebens schultern können.","409",NA
"Der Staat hilft beim Bausparen mit der Wohnungsbauprämie sowie mit der Arbeitnehmer-Sparzulage.","409",NA
"Mit der Einführung der staatlich geförderten Eigenheimrente – als eine neue Form des Bausparens – haben CDU und CSU eine wichtige Maßnahme auf den Weg gebracht, um den Eigentumserwerb zu erleichtern.","409",NA
"Dieses Finanzpolster hilft, den Wunsch nach eigenen vier Wänden solide zu finanzieren.","409",NA
"Die wachsenden Ansparsummen zeigen, dass das Instrument angenommen wird und lassen für die kommenden Jahre auch eine weiter steigende Eigentumsbildung im Wohnungsbau erwarten.","409",NA
"CDU und CSU sehen Wohneigentum auch als bewusste Entscheidung der Menschen für die Region und als Teil der Altersvorsorge.","505",NA
"Deshalb wollen wir mit Blick auf die in manchen Regionen rückläufigen Bevölkerungszahlen die Möglichkeit schaffen, dass der Erwerb von Bestandsimmobilien, d. h. bereits vorhandene Wohnungen und Häuser, besser unterstützt wird als der Neubau.","409",NA
"Das ist ein wichtiges Signal zur Aufwertung von Immobilien in oft schwierigen Märkten.","409",NA
"Zu Hause ist es am schönsten – auch in Zukunft",NA,NA
"Die steigende Lebenserwartung bringt neue Herausforderung an die Stadtentwicklung und den Wohnungsbau.","706",NA
"Unser Ziel ist es, dass die Menschen möglichst lange in ihrer häuslichen Umgebung leben können.","706",NA
"Dafür wollen wir mehr generationengerechten Wohnraum, der den Alltagsbedürfnissen von Familien mit Kindern bis hin zu denen von Senioren entspricht.","706",NA
"Dazu kann auch der Umbau von vorhandenem Wohnraum beitragen.","706",NA
"Ebenso sehen wir, dass gemeinschaftliche Wohnformen auch bei älteren Menschen zunehmend Zuspruch erhalten.","606",NA
"Das wollen wir unterstützen.","606",NA
"Wohnungsnahe Dienstleistungsangebote entlasten Menschen im Alltag und sollen gezielt ausgebaut werden.","402",NA
"Für die verbesserte technische Ausstattung von generationengerechten Wohnungen werden wir die Forschung und Entwicklung in diesem Bereich unterstützen.","411",NA
"Die Stadtumbauprogramme haben sich bewährt.","404",NA
"Wir wollen sie zu einem einheitlichen, inhaltlich aufgewerteten und integrierten Stadtumbauprogramm zusammenführen.","404",NA
"In das Programm sollen alle Akteure, insbesondere die Wohnungsgesellschaften, die privaten Immobilienbesitzer und die Gewerbetreibenden einbezogen werden.","202",NA
"5.4 Gute Lebensmittel – nachhaltige Landwirtschaft",NA,NA
"Die deutschen Land-und Forstwirte produzieren hochwertige Lebens-und Futtermittel, nachwachsende Rohstoffe und einen großen Teil der erneuerbaren Energien.","703",NA
"Sie gewährleisten damit nicht nur die Lebensgrundlage der Menschen, sondern sie prägen unsere Heimat durch die Pflege der Kulturlandschaft und den Erhalt von Traditionen.","703",NA
"CDU und CSU wollen eine starke und in der Gesellschaft breit verankerte Land-und Forstwirtschaft.","703",NA
"Wir wollen, dass möglichst viel von dem, was wir essen und an nachwachsenden Rohstoffen brauchen, von den Feldern und aus den Ställen unserer Bauern und aus den heimischen Wäldern kommt.","703",NA
"Uns leiten klare Grundsätze für eine verlässliche und nachhaltige Agrarpolitik: Wir haben Vertrauen in die heimische Land-und Forstwirtschaft und bleiben ihr ein verlässlicher Partner.","703",NA
"Zugleich fördern wir angesichts sich verändernder Verbraucherwünsche und gestiegener gesellschaftlicher Anforderungen Offenheit, Information und Dialog.","403",NA
"Probleme, Fragen und Sorgen der Bürger in Bezug auf die landwirtschaftliche Produktion im Ackerbau und in der Tierhaltung, insbesondere beim Umwelt-und Tierschutz, nehmen wir sehr ernst und lösen sie gemeinsam mit den Landwirten.","703",NA
"Unser Leitbild ist die bäuerlich unternehmerische Landwirtschaft, getragen von den Landwirten und ihren Familien vor Ort.","703",NA
"Besonders die regionale Verwurzelung,","703",NA
"nachhaltiges Wirtschaften,","416",NA
"Eigentum und Verantwortung für den Betrieb,","401",NA
"aber auch für Gesellschaft und Umwelt sind uns dabei wichtig.","416",NA
"Eine von Kapitalinvestoren bestimmte Landwirtschaft lehnen wir ab.","703",NA
"Wir stehen zur Vielfalt unserer Landwirtschaft – konventionelle und ökologische Wirtschaftsweise stehen gleichberechtigt nebeneinander.","703",NA
"Wir fördern Haupt-, Zu-und Nebenerwerbsbetriebe, weil alle einen wichtigen Beitrag zu unserer leistungsstarken Landwirtschaft leisten.","703",NA
"Zukunftsfähige Umsetzung der EU-Agrarpolitik 2014 bis 2020",NA,NA
"Für die deutsche Landwirtschaft ist die Agrarpolitik der EU von großer Bedeutung.","703",NA
"Wir wollen, dass die Gelder aus Brüssel bei den Landwirten ankommen und möglichst effizient eingesetzt werden.","703",NA
"Dafür ist es wichtig, beide Säulen, auf denen die Landwirtschaftspolitik der EU aufbaut, zu erhalten.","703",NA
"Aus der ersten Säule erhalten die Landwirte Direktzahlungen für ihre Leistungen für die Gesellschaft, die nicht über den Markt abgegolten werden wie beispielsweise die Landschaftspflege und Umwelt-, Tierschutz und Verbraucherstandards in Europa.","703",NA
"Die zweite Säule unterstützt die Entwicklung in den ländlichen Räumen und die Umsetzung von Maßnahmen für eine umweltgerechte Landwirtschaft.","703",NA
"Überlegungen von Rot-Grün, die Direktzahlungen an die Landwirte zu kürzen, lehnen wir ab.","703",NA
"Zur Stärkung der bäuerlichen Landwirtschaft und der Familienbetriebe wollen wir die ersten Hektare jedes Landwirtschaftsbetriebs künftig mit einem höheren Betrag an Direktzahlungen fördern.","703",NA
"Besonders werden wir Junglandwirte unterstützen und junge Menschen ermuntern, den Beruf des Landwirtes zu ergreifen.","703",NA
"Unser Ziel ist es, Umwelt und Landwirtschaft noch enger miteinander zu verzahnen.","703",NA
"Wir stehen zum sogenannten „Greening“, das heißt der noch stärkeren Bindung der Direktzahlungen an Umweltleistungen.","501",NA
"Eine verpflichtende Stilllegung von landwirtschaftlichen Flächen wird es mit uns nicht geben.","703",NA
"Über die zweite Säule werden wir weiterhin zukunftsfähige Entwicklungen im ländlichen Raum fördern, der ganz besonders von einer starken Land-und Forstwirtschaft lebt.","703",NA
"Deshalb werden wir Agrarumweltprogramme ausbauen und Investitionen in die Betriebe ermöglichen.","703",NA
"Wir werden auch in Zukunft ein wirksames Sicherheitsnetz spannen zum Schutz unserer Landwirte vor extremen Markteinbrüchen.","703",NA
"Wir werden die Beschlüsse aus Brüssel mit so wenig Bürokratie wie möglich umsetzen.","303",NA
"Gute Tierhaltung und bester Tierschutz",NA,NA
"Artgerechte Tierhaltung und ein hohes Tierschutzniveau sind für uns von zentraler Bedeutung.","501",NA
"Wir wollen Ställe, in denen Tiere gute Haltungsbedingungen haben.","501",NA
"Deshalb fördern wir neue tiergerechte Ställe und erhöhen die Forschungsmittel zur Verbesserung der Haltungsformen.","501",NA
"Ebenso werden wir die Maßnahmen zur Verringerung des Einsatzes von Antibiotika in der Tierhaltung vorantreiben.","501",NA
"Sachkunde und Qualifikation sind für uns unabdingbare Voraussetzung für die Tierhaltung.","501",NA
"Wir setzen uns für einheitlich höhere Tierschutzstandards mit einer Reduzierung und festen Begrenzung der Tiertransportzeiten in der EU ein.","501",NA
"Der wichtigen Arbeit der Imker gilt unsere Wertschätzung.","703",NA
"Zum Schutz der Bienen werden wir Forschungsprojekte ausbauen.","501",NA
"Die Milcherzeuger im Wettbewerb stärken",NA,NA
"Wir wollen, dass Deutschland auch nach dem Auslaufen der Milchmengenregelung 2015 Milchland Nummer eins in Europa bleibt.","703",NA
"Dazu werden wir die Milcherzeuger bei der Entwicklung ihrer Betriebe unterstützen, ihre Position am Markt und in der Wertschöpfungskette stärken und die Zusammenarbeit zwischen Erzeugern und Verarbeitern befördern.","703",NA
"Zudem werden wir die Milchbauern bei der Erschließung zusätzlicher Einkommensmöglichkeiten, wie z. B. der Gülleverwertung in kleinen Biogasanlagen unterstützen.","703",NA
"Weiterhin wollen wir die Grünlandwirtschaft auch beim Greening anerkennen und prüfen die Einführung einer Raufutterprämie.","703",NA
"Markt-und Verbraucherorientierung auf regionalen wie internationalen Märkten – Bundesregionalprogramm",NA,NA
"Die deutsche Landwirtschaft soll sowohl die Chancen der heimischen Märkte als auch des europäischen und des stark wachsenden Weltmarkts nutzen können.","703",NA
"Dazu werden wir die deutsche Agrar- und Ernährungswirtschaft bei der Erschließung von Exportmärkten auch weiterhin unterstützen.","703",NA
"Besonders wichtig ist uns die Stärkung der regionalen Märkte.","403",NA
"Immer mehr Menschen richten ihre Kaufentscheidung danach aus, woher die Lebensmittel kommen.","403",NA
"Dafür brauchen sie verlässliche und schnell erkennbare Informationen.","403",NA
"Wir werden ein Bundesregionalprogramm starten, mit dem wir Transparenz beim Einkauf regionaler Lebensmittel schaffen.","403",NA
"Als ein Element werden wir das von der Bundesregierung entwickelte „Regionalfenster“ für die Lebensmittelpackung bundesweit einführen.","403",NA
"Die deutschen Ökobetriebe werden wir weiter verlässlich fördern.","703",NA
"Unser Ziel ist es, die große Nachfrage nach Bioprodukten mit heimischen Erzeugnissen zu befriedigen.","703",NA
"Schutz land-und forstwirtschaftlicher Flächen verbessern",NA,NA
"Wir wollen möglichst viele land-und forstwirtschaftliche Flächen erhalten.","501",NA
"Deshalb wollen wir den Bau neuer Gebäude und Straßen so gestalten, dass dafür möglichst wenig unbebaute Flächen genutzt werden müssen.","501",NA
"Dort, wo die Nutzung neuer Flächen nicht vermeidbar ist, wollen wir den erforderlichen Naturschutzausgleich verstärkt auf Umweltmaßnahmen der Land-und Forstwirtschaft, die Aufwertung und Pflege schon bestehender Ausgleichflächen und Naturschutzgebiete sowie die Entsiegelung von bebauten Flächen konzentrieren.","501",NA
"Die Möglichkeiten für die Zahlung von Ersatzgeld wollen wir ausweiten.","703",NA
"Mit den Zahlungen wollen wir einen Fonds schaffen, aus dem der Rückbau bebauter, aber nicht mehr gebrauchter Flächen in einen naturnahen Zustand erfolgen kann.","501",NA
"Wettbewerbsfähigkeit und Qualifikation fördern",NA,NA
"Investitionen für neue Maschinen, Anlagen und Produkte","703",NA
"sowie die Ausbildung der Beschäftigten und deren Weiterqualifikation sind die Grundlagen für eine zukunftsfähige Entwicklung der Agrarwirtschaft","703",NA
"und für mehr Tier-und Umweltschutz.","501",NA
"Wir werden sie weiter verlässlich mit den Mitteln der Gemeinschaftsaufgabe Agrarstruktur und Küstenschutz (GAK) fördern.","703",NA
"Wir werden die Agrarforschung ausbauen.","703",NA
"Schwerpunkte der Forschungen sind die Entwicklung besonders tiergerechter Haltungsverfahren, die effiziente und verantwortungsvolle Nutzung der Biomasse für Nahrungsmittel, Bioenergie und nachwachsende Rohstoffe sowie die Gewährleistung der Lebensmittelsicherheit.","703",NA
"Mit einer Innovationsoffensive wollen wir die deutsche Agrarwirtschaft bei der Bewältigung neuer Herausforderungen unterstützen.","703",NA
"Damit die Landwirte sich gegen Preis-und Ertragsschwankungen besser absichern können, werden wir unseren Landwirten die steuerliche Risikorücklagenbildung erleichtern.","703",NA
"Bioenergie und nachwachsende Rohstoffe verantwortungsvoll nutzen",NA,NA
"Die Erzeugung von Nahrungs-und Futtermitteln durch die deutsche Landwirtschaft hat auch in Zukunft Vorrang vor einer Nutzung zur Energie-oder Kraftstoffgewinnung.","703",NA
"Dort, wo nachwachsende Rohstoffe für die energetische Nutzung verwendet werden, setzen wir auf mehr Marktorientierung, d. h. auf Erzeugung und Lieferung nach Bedarf.","703",NA
"Wir werden bei neuen Biogasanlagen insbesondere die bedarfsgerechte Verstromung und die Nutzung von Reststoffen fördern.","703",NA
"Zudem werden wir die Erforschung neuartiger Energiepflanzen als Alternative zum Mais ausbauen","703",NA
"und uns für die Fortführung der Beimischquoten im Biokraftstoffbereich einsetzen.","703",NA
"Nachhaltige Waldbewirtschaftung",NA,NA
"In diesem Jahr erinnern wir an den 300. Jahrestag der Einführung des Nachhaltigkeitsbegriffs durch Hans Carl von Carlowitz.","416",NA
"Der von ihm erstmals beschriebene Begriff hat für uns bis heute Gültigkeit.","416",NA
"Mehr als ein Drittel der Fläche Deutschlands ist Wald.","703",NA
"Unser Wald ist nicht nur als Lieferant des natürlichen Rohstoffs Holz wichtig, sondern auch für Umwelt und Naturschutz sowie die Erholung der Menschen unverzichtbar.","703",NA
"Nachhaltige Forstwirtschaft sichert diese Funktionen.","703",NA
"Dazu wollen wir die Wertschöpfungskette Holz weiter stärken.","703",NA
"Die Leistungsfähigkeit der überwiegend kleinteiligen Eigentümerstruktur wollen wir erhöhen, indem wir die Zusammenarbeit zum Beispiel in der Vermarktung von Holz fördern.","703",NA
"Der Aufbau klimastabilerer Wälder mit unterschiedlichen Baumarten ist uns wichtig.","501",NA
"Zur Förderung der Nutzung von nachhaltig erzeugtem heimischem Holz unterstützen wir eine Herkunftskennzeichnung.","703",NA
"Wir bekennen uns zur Jagd, die einen wichtigen Beitrag für Natur und Tierwelt sowie für die Umweltpflege leistet.","703",NA
"Deshalb werden wir das Jagdrecht in der jetzigen Form erhalten.","703",NA
"Stabiles landwirtschaftliches Sozialversicherungssystem",NA,NA
"Das eigenständige Sozialversicherungssystem für die Landwirtschaft hat sich bewährt.","703",NA
"Wir stehen dafür ein, dass es sich im Gleichklang mit den anderen gesetzlichen Sozialversicherungen entwickelt und auch in Zukunft die Beiträge der Landwirtschaft bezahlbar bleiben.","703",NA
"Stärkung des deutschen Wein-und Gartenbaus",NA,NA
"Wein ist eines der ältesten Kulturgüter Deutschlands.","703",NA
"Der Weinbau prägt viele deutsche Landschaften in einzigartiger Weise.","703",NA
"Damit die klassischen Weinbaugebiete, insbesondere der Steillagenweinbau in Deutschland erhalten bleiben, setzen wir uns für eine wirksame EU-Weinmarkt-Regelung ein.","703",NA
"Der Gartenbau ist Teil unseres starken Mittelstands.","703",NA
"Wir werden ihn beispielsweise bei der Entwicklung energiesparender Produktionsweisen weiter unterstützen.","703",NA
"Keine Biopatente auf Nutztiere und Nutzpflanzen",NA,NA
"Die breite Vielfalt von Nutztieren und Pflanzen ist eine besondere Stärke unserer Landwirtschaft.","703",NA
"Diese wollen wir sichern und auch nicht von der weltweit steigenden Zahl von Patentanmeldungen auf Tiere und Pflanzen gefährden lassen.","703",NA
"Für uns gibt es Unterschiede zwischen einem Patent auf ein Auto und einem Apfel.","703",NA
"Deshalb sprechen wir uns gegen Patente auf herkömmliche Züchtungsverfahren aus und wenden uns auch gegen die Patentierbarkeit von landwirtschaftlichen Nutztieren und Nutzpflanzen daraus.","703",NA
"5.5 Verbraucher stärken",NA,NA
"Wir trauen den Menschen etwas zu.","201",NA
"Unser Leitbild ist der eigenverantwortlich handelnde Verbraucher.","201",NA
"Er braucht transparente, verständliche und vergleichbare Angebote.","403",NA
"Aufgabe von Verbraucherpolitik ist es, dafür zu sorgen, dass die Produkte sicher sind und die Verbraucher verständliche Informationen erhalten.","403",NA
"Verbraucher brauchen starke Rechte, aber keine Bevormundung.","201",NA
"Angesichts des freien Warenverkehrs in Europa und des zunehmenden weltweiten Handels reichen nationale Regelungen allein nicht mehr aus, um Verbraucher wirksam zu schützen.","108",NA
"Deshalb setzen wir uns dafür ein, die EU-Verbraucherpolitik auszubauen und das hohe deutsche Schutzniveau in ganz Europa zu verankern.","108",NA
"CDU und CSU haben in der Verbraucherpolitik viel erreicht: Beispiele dafür sind eine bessere Lebensmittelkennzeichnung, die Einführung von Fahrgastrechten mit Entschädigungspflicht bei Verspätungen und die bessere Information bei Geldanlagen.","403",NA
"Verbraucher dürfen am Telefon nicht mehr mit Werbeanrufen belästigt werden und wer sich in der Warteschleife von Servicenummern befindet, muss dafür nicht mehr bezahlen.","403",NA
"Einrichtungen zum Schutz des Verbrauchers verlässlich unterstützen und Experten einbinden",NA,NA
"Diesen erfolgreichen Weg des Verbraucherschutzes wollen wir konsequent weiter gehen.","403",NA
"Deshalb werden wir Organisationen zur Beratung der Verbraucher, wie zum Beispiel die Stiftung Warentest und den Verbraucherzentrale Bundesverband (vzbv), weiter unterstützen.","403",NA
"Darüber hinaus werden wir einen „Sachverständigenrat für Verbraucherpolitik“ mit unabhängigen Experten und Wissenschaftlern einrichten.","303",NA
"Er soll regelmäßig einen „Lagebericht der Verbraucher“ mit Empfehlungen an die Politik erstellen.","303",NA
"Die in Deutschland in den vergangenen Jahren erfolgreich verankerte Verbraucherforschung werden wir ausbauen und weiter vernetzen, um neueste Erkenntnisse in die Verbraucherpolitik einfließen zu lassen.","403",NA
"Verbraucherbildung von klein an",NA,NA
"Verbraucherbildung beginnt von klein an in der Kita, in den Schulen und geht bis zur Erwachsenenbildung, zum Beispiel in den Volkshochschulen.","506",NA
"Zusammen mit den Ländern arbeiten wir daran, dass Verbraucherbildung ein fester Bestandteil in den Bildungseinrichtungen wird.","506",NA
"Dazu gehört, das Wissen über ausgewogene Ernährung und gute Haushaltsführung, über finanzielle Angelegenheiten und den Umgang mit den digitalen Medien zu stärken.","506",NA
"Wegweiser durch die Konsumwelt",NA,NA
"Im Alltag ist es für Verbraucher wichtig, dass sie schnell und einfach auf Verbraucherinformationen zugreifen können und vertrauenswürdige und kundenfreundliche Unternehmen schnell erkennen können.","403",NA
"Deshalb wollen wir als Wegweiser für Verbraucher zum Beispiel Verbraucher-Apps und kompakt Informationen anbieten.","403",NA
"Wir werden das Projekt „Klarheit und Wahrheit“ mit der Internetplattform „Lebensmittelklarheit.de“ auch für andere Felder entwickeln, wie zum Beispiel bei Haushaltswaren und Bedarfsgegenständen.","403",NA
"Auf dieser Internetplattform können Verbraucher Produkte nennen, von denen sie sich getäuscht fühlen.","403",NA
"Die Verbraucherzentrale bewertet die Kennzeichnung und die betroffenen Unternehmen können dazu Stellung nehmen.","403",NA
"Gemeinsam mit Rechtsexperten, Verbraucher-und Datenschützern sowie Wissenschaftlern werden wir Kriterien für einen Check Allgemeiner Geschäftsbedingungen (AGB-Check) entwickeln.","403",NA
"Er soll die Verbraucherfreundlichkeit transparent machen.","403",NA
"Wir wollen, dass hochwertige und benutzerfreundliche Produkte ein Markenzeichen der deutschen Wirtschaft bleiben.","403",NA
"Dafür werden wir ein Verbraucher-Siegel schaffen.","403",NA
"Unternehmen können sich damit ihre Verbraucherfreundlichkeit bestätigen lassen.","403",NA
"Anhand dieses Gütesiegels lassen sich dann verbraucherfreundliche Unternehmen besonders leicht erkennen.","403",NA
"Das schafft ein Mehr an Vertrauen und Sicherheit.","403",NA
"Verbraucherrechte besser durchsetzen",NA,NA
"Verbraucher sollen im Streitfall schnell und einfach zu ihrem Recht kommen.","403",NA
"Dazu werden wir einen bundesweiten Online-Schlichter einführen, der unbürokratisch hilft, wenn beim Kauf im Internet etwas schief geht.","403",NA
"Sichere Lebensmittel – Betrug europaweit erschweren",NA,NA
"Sichere Lebensmittel, klare Kennzeichnung und gesunde Ernährung sind für uns zentral.","403",NA
"Dazu gehört Null-Toleranz bei Betrug im Lebensmittelbereich.","605",NA
"Wir wollen Lebensmittelbetrug europaweit erschweren und härter bestrafen.","605",NA
"Lebensmittelskandale können so rasch und umfassend aufgedeckt werden.","605",NA
"Die staatliche Überwachung auf Ebene des Bundes und der Länder muss verbessert werden.","605",NA
"Wir wollen die Einfuhrkontrollen an den Außengrenzen der EU sowie die Kontrollen im Inland stärken.","605",NA
"Wir brauchen EU-und bundesweit eine hohe Kontrolldichte und einheitlich hohe Standards.","605",NA
"Private und staatliche Kontrollen werden wir noch besser verzahnen und die Anforderungen an die Eigenkontrollsysteme der Unternehmen erhöhen.","605",NA
"Wir werden ein Frühwarnsystem für den Lebensmittelsektor in Europa entwickeln, das wirtschaftliche Anreize für Betrüger frühzeitig ausfindig machen soll.","403",NA
"Keiner soll an Lebensmittelbetrug verdienen.","605",NA
"Neben härteren Strafen wollen wir auch die Möglichkeiten zur Abschöpfung von Gewinnen, die durch kriminelle Handlungen im Lebensmittelbereich erzielt wurden, umsetzen.","605",NA
"Klare Kennzeichnung von Lebensmitteln",NA,NA
"Für uns gilt: Lebensmittel müssen klar gekennzeichnet sein.","403",NA
"Dazu gehört, dass alle Angaben gut lesbar sind und die Verpackung dem Inhalt entspricht.","403",NA
"Verbraucher sollen auch wissen, ob Lebensmittel mit gentechnischen Verfahren erzeugt worden sind, aus welcher Region ein Produkt kommt und unter welchen Bedingungen Tiere gehalten werden.","403",NA
